Content Title,Content Description,Content Type,Content Last Watched Date (if viewed),Content Completed At (if completed),Content Saved,Notes taken on videos (if taken),
CI/CD Glossary,Glossary for CI/CD terms.,Article (3rd Party Provider),2025-07-24 00:53 UTC,2025-07-24 00:53 UTC,false,N/A,
ISTQB Foundation Cert Prep,"Are you looking to move into the dynamic and exciting world of software testing? An International Software Testing Qualifications Board (ISTQB) certification can be one steppingstone on your journey. The ISTQB exams can be difficult to traverse without a solid understanding of the course material and the expectations of the exam board. In this course, instructor Michael Smith covers all these things. Michael explains key terminology that you will need to know for the ISTQB exams. After describing the principles, process, and psychology of testing, Michael goes into how software testing fits into the overall software development lifecycle (SDLC). He discusses static testing, a variety of test techniques, and helpful information on organizing, planning, monitoring, and managing your tests. Michael finishes up by showing you some test tool considerations and tips, as well as additional help in getting ready for the ISTQB Foundation exam.",Course,2022-08-09 14:09 UTC,N/A,false,N/A,
Querying Microsoft SQL Server 2022,"Want to learn more about how to query data from SQL Server tables? In this course, instructor Adam Wilbert covers how to retrieve information stored in a Microsoft SQL Server database using the Transact-SQL (T-SQL) language and the updated features of SQL Server 2022.<br><br>Learn the fundamental structure of a successful query, from ideation to execution. Find out how to manipulate data through the use of built-in functions, operators, filters, and other language features to return a data set, ensuring that it’s properly formatted and applicable to a wide variety of needs and perspectives. Along the way, Adam gives you tips and pointers on how to get the most out of your queries. Upon completing this course, you'll be equipped with the commands and keywords you need to know to analyze your data more effectively.",Course,2025-07-21 19:46 UTC,N/A,false,N/A,
Test Automation with Python: 1 Introduction to Automated Testing,"The <i>Test Automation with Python</i> series from Headspin University is designed to teach automation skills and tools for testing applications in Appium and Selenium, the world's most popular UI automation tools. But before getting into the automation itself, this first course delves into the concept of testing, from the etymology of the word, to how to design useful tests for your software. While using software as it is meant to be run seems like an obvious test, it’s also helpful and necessary to imagine conditions for the software that its developers might not have thought about. The history of automation is also covered, highlighting the fact that most software is in fact a form of automation. After this course, you’ll have a solid foundation of automated testing and be ready to move on to the next course in the series.
<br><br>
Note: This course was created by HeadSpin University. We are pleased to host this training in our library.",Course,2025-07-24 00:31 UTC,2025-07-24 00:27 UTC,false,N/A,
Enterprise Architecture in Practice,"Enterprise architecture (EA) is largely an art that's best taught by example. The alignment of technology and business strategies requires a nuanced understanding of how to manage people, processes, and the technical assets that power an organization. In this course, Dave Swersky focuses on the practical applications of EA as he steps through the technological transformation of a fictional company, Brick & Mortar. Throughout the course, Dave shows how an executive would assess the technology in use by Brick & Mortar, and then create and execute a plan to modernize. Learn how to build your EA team and produce roadmaps for strategic planning. Plus, discover what the day-to-day operations of an EA team looks like, as well as how to tackle common challenges.",Course,2026-04-20 12:25 UTC,N/A,false,N/A,
Leadership in Tech,"Erica Lockheimer successfully rose through the ranks at LinkedIn to become a VP of engineering. In this course, she interviews other leaders—all of whom inspired her own professional journey—about what it takes to carve out a lasting career in the lively, challenging world of tech. Erica chats with a variety of leaders in the tech space, including LinkedIn CEO Jeff Weiner and Tanya Staples, the VP of product, learning content at LinkedIn, about key aspects of their jobs. Along the way, she gleans insights on everything from cultivating awareness as a leader to maintaining a stable work and life balance.<br></br>Whether you're already a seasoned leader or you're just starting out, this course can equip you with the knowledge you need to lead with compassion and take your career to new heights.",Course,2019-09-11 21:37 UTC,N/A,false,N/A,
How to Speak Smarter When Put on the Spot,"<p>Public speaking can be nerve-wracking even with ample preparation time. An unexpected spotlight can further ramp up the heart-pounding, word-fumbling, and mind-blanking. In this audio-only course, Matt Abrahams shares six easy steps to improve spontaneous speaking.</p>

<p>Matt Abrahams teaches strategic communication at Stanford University and hosts a top podcast: Think Fast, Talk Smart. He is the author of two best-selling books on speaking: <i>Speaking Up without Freaking Out and Think Faster, Talk Smarter</i>.<p>

<p>Matt shares how you can listen deeply to better respond and connect with any audience. You’ll learn tactics to address anxiety–such as holding something cold. Matt shares why to “maximize your mediocrity” and offers a formula for great self-introductions. Finally, get expert strategies for recovering quickly when you draw a blank and approaches for “preparing to be spontaneous.”</p>
<p>This course was created by Pete Mockaitis of <a href=""https://awesomeatyourjob.com/"" target=""_blank""><i>How to Be Awesome at Your Job</i></a>. We are pleased to offer this training in our library.</p>
<img src=""https://media.licdn.com/media/AAYAAgCwAAoAAQAAAAAAAIBpAic0FsSvQXaA8NB7qnVcIw.jpg"" alt=""Company logo for How to Be Awesome at Your Job"" width=""20%"" height=""20%"" />",Course,2025-06-17 17:23 UTC,N/A,true,N/A,
API Test Automation with SoapUI,"With industry trends like cloud computing and the Internet of Things, there is a growing need for testers that know and understand API testing tools. One powerful and mature tool used by companies around the world is SoapUI. This course is designed to help you get started with SoapUI and covers the basics of how to use it. Instructor Dave Westerveld explains how to set up your first project, create new tests, perform load and security testing, test SOAP APIs, and make your tests more automated and efficient with scripting. Plus, learn how to integrate SoapUI with Docker-based build pipelines. The training is filled with examples featuring real-world, public APIs so you can see how SoapUI functions in real testing scenarios.",Course,2026-05-09 17:13 UTC,N/A,false,N/A,
"Advanced Playwright Techniques: Optimizing Speed, Stability, and Cloud Testing","This course dives deep into advanced Playwright testing strategies, and is designed to help experienced testers and developers optimize their test suites for speed, stability, and scalability. Learn how to streamline your tests, diagnose and fix bottlenecks, and apply resilient practices that make your testing robust against flakiness. Additionally, explore the power of visual testing using screenshots and snapshots, ensuring UI consistency with minimal resource usage. Finally, instructor Qambar Raza guides you through configuring and running tests on Microsoft Playwright Testing service, enabling you to scale tests effortlessly in the cloud. By the end, you’ll have a high-performing Playwright testing suite ready for modern application needs.",Course,2026-05-06 11:34 UTC,N/A,false,N/A,
Jira Administration: Automation,"Automation is the most fun part of Jira administration! It’s easy to build simple and complex rules so you can focus on more important admin tasks instead. In this course, instructor Rachel Wright shows you how to use automation to communicate and update information, effortlessly repeat frequent tasks, sync information between issues, perform routine maintenance, calculate values, and automatically send reminders and alerts. With Atlassian’s no-code engine and low-code apps you can accomplish work faster, with less clicks, and less human error.",Course,2026-03-31 17:30 UTC,N/A,false,N/A,
NIST 800-53r5: Introduction to Security and Privacy Controls,"<p>NIST SP 800-53 Rev. 5 provides guidance on establishing collaboration between security and privacy programs for selecting and implementing controls. In this course, designed by industry-leading cybersecurity professional development platform Cybrary,  explore the essentials of the security and privacy controls covered in NIST 800-53 Rev. 5, including how to work control families, the anatomy of a control, control selection, control types, organizational variables, system security planning, and control assessment.</p><p>Note: This course was created by Cybrary. We are pleased to host this training in our library.</p>",Course,2026-05-21 16:08 UTC,N/A,false,N/A,
DevOps Foundations: Continuous Delivery/Continuous Integration,"<p>Continuous delivery is one of the major DevOps practice areas. By continuously building, testing, and delivering your code, you can reap huge stability, speed, and flexibility benefits. In this course, learn about continuous integration and continuous delivery (CI/CD), and see how these concepts work in practice by constructing your own build pipeline. Throughout this course, instructors James Wickett and Ernest Mueller discuss elements of the pipeline as they show how to take an app written in the Golang programming language from development to production. They walk through version control, building artifacts, unit testing, and deployment, demonstrating common practices and tools along the way. They conclude with some practical advice on CI/CD best practices and common pitfalls, workarounds, and compromises that you may encounter on your journey to continuous delivery.</p><p>This course is part of a <a href=""https://www.linkedin.com/learning/paths/devops-professional-certificate-by-pagerduty-and-linkedin?u=104"" target=""_blank"">Professional Certificate</a> from PagerDuty.</p>",Course,2025-07-30 13:17 UTC,N/A,false,N/A,
Excel: VLOOKUP and XLOOKUP for Beginners (2021),"Many Excel users hear “VLOOKUP” and envision a complicated function reserved only for power users. Not so! VLOOKUP—and XLOOKUP, the newer version for 365 subscribers—are among Excel’s most powerful functions, yet you can master them with a few simple steps. In this mini-course, Jess Stratton walks you step-by-step through creating a simple lookup in Excel using both VLOOKUP and XLOOKUP, then shows you how to error-proof your formulas. Supercharge your Excel skills and save time with these powerful lookup functions.",Course,2021-09-15 13:39 UTC,N/A,false,N/A,
DevOps Foundations: Infrastructure as Code,"<p>Infrastructure automation—transitioning an organization's system administration from hardware into code—is one of the major DevOps practice areas. By automating configuration management, you can make your systems more reliable, processes more repeatable, and server provisioning more efficient. In this course, learn the basics of infrastructure as code (IaC), including how to keep your configuration in a source code repository and have it built and deployed just like an application.
 </p><p>
Discover how to approach converting your systems over to becoming fully automated—from server configuration to application installation to runtime orchestration. Join notable DevOps practitioners Ernest Mueller and James Wickett as they dive into key concepts, and use a wide variety of tools to illustrate those concepts, including Ansible, Terraform, Docker, Kubernetes, Serverless, and AWS Lambda. Ernest and James also explore how AI can accelerate IaC workflows and how IaC supports security and compliance objectives. Check out this course to gain the knowledge you need to start implementing an infrastructure as code strategy.</p><p>This course is part of a <a href=""https://www.linkedin.com/learning/paths/devops-professional-certificate-by-pagerduty-and-linkedin?u=104"" target=""_blank"">Professional Certificate</a> from PagerDuty.</p>",Course,2025-07-24 00:36 UTC,N/A,true,N/A,
Nano Tips to Ditch Self-Doubt with Shade Zahrai,"<p>Welcome to our <i>Nano Tips</i> series, where LinkedIn Learning creators deliver impactful lessons in literally seconds. In this installment, explore what it takes to overcome self-doubt and leverage a growth mindset, following advice and practical, easy-to-apply insights from award-winning leadership strategist and peak performance specialist Shadé Zahrai.</p><p>Discover strategies to manage self-doubt as a sign of progress, build confidence, and visualize outcomes while preparing for complex challenges. Learn to embrace discomfort for growth, counteract anxiety with intentional actions, and focus on personal progress by letting go of perfection. Along the way, Shadé shares techniques to help you control your mental narrative, identify self-doubt, and build empathy and self-compassion by focusing on positive traits in others.</p><p>This course was created by Shadé Zahrai. We are pleased to host this training in our library.</p>",Course,2026-05-16 15:27 UTC,N/A,false,N/A,
"Playwright Essential Training: Abstractions, Fixtures, and Complex Scenarios","Playwright is a newer tool that has joined the ranks of Cypress and Selenium in open-source automation tooling. Playwright works right out of the box, and its comprehensive feature set allows testers and developers to quickly create new test automation projects without having to rely on combining multiple libraries and tools together. Whether you are a manual tester looking to dip your toes into test automation or a seasoned test automation engineer, check out this course to get hands-on experience with the top features that make Playwright a great choice for your automated tests. Instructor Butch Mayhew takes you through some advanced features and covers best practices for writing, running, and maintaining tests as you scale with Playwright.",Course,2026-04-09 11:50 UTC,N/A,true,N/A,
C# and .NET Essential Training,"Microsoft .NET is a modern, cross-platform framework for developing applications for the web, desktop, and mobile devices. This course gives an introduction to some of the features of .NET that makes building applications easier, more performant, and more productive. Veteran technologist Joe Marini demonstrates how to use built-in capabilities of .NET such as string processing, data collection types, number and date formatting, reading and writing files, and even working with regular expressions. Joe also introduces hands-on code challenges to help you practice what you learn. By using these built-in features, you can focus more on your core application logic and less on having to build common capabilities from scratch.",Course,2026-06-07 15:59 UTC,N/A,false,N/A,
Playwright Python and Pytest for Web Automation Testing: Master Modern Web Testing with Playwright and Pytest in Python,"Unlock the full potential of web automation testing using Playwright and Pytest in Python. This course takes you from installation and setup to advanced testing workflows, guiding you through browser automation, UI interaction, and reliable locator strategies. Learn how to simulate real-world user actions, manage asynchronous events, and validate application behavior through dynamic and robust tests. With extensive Pytest integration, you'll structure scalable test suites using fixtures, scopes, and reusable components. Explore file uploads, keyboard events, event listeners, and assertions with hands-on examples. Build advanced frameworks using the Page Object Model, handle authentication scenarios, and test network and API flows effectively. You’ll also optimize performance through parallel test execution, request interception, and JavaScript disabling. Implement CI/CD automation with GitHub Actions, apply data-driven techniques with pytest.mark.parametrize, and dive into BDD workflows using Behave. Designed for technical professionals, this course helps you conquer modern testing processes with practical, maintainable, and production-ready code.",Course,2026-05-20 02:31 UTC,N/A,false,N/A,
Test Automation Foundations,"<p>Automated testing relies on scripting and frameworks like Selenium to prove that products work as expected. Test automation is an enormous time-saver, and it's crucial to continuous integration, continuous delivery, and agile software development. If you're employed in QA, DevOps, or IT, you need to know the basics. This course covers the foundations of test automation, as well as different strategies for implementation. QA engineer Meaghan Lewis explains what kinds of tests to use, how to choose the right test tools, and how to plan and execute test automation projects. She also describes strategies to maintain automation over time: adding new tests, updating old tests, and resolving failures. </p><p>This course is part of a <a href=""https://www.linkedin.com/learning/paths/lambdatest-test-automation-professional-certificate"" target=""_blank"">Professional Certificate</a> from LambdaTest.</p>",Course,2022-05-18 10:15 UTC,N/A,true,N/A,
Career Wellness Nano Tips with Shadé Zahrai,"Welcome to our <i>Nano Tips</i> series, where LinkedIn Learning creators deliver impactful lessons in literally seconds.<br><br>In this course, get some quick tips on how to better manage your work life and career. Check out some practical advice on workload prioritization, emotional self-regulation, and managing overwhelming work experiences. Also learn how to bring empathy to work, receive feedback with confidence, and even find out the real reason behind procrastination.",Course,2022-05-08 04:38 UTC,N/A,false,N/A,
Testing in React with Vitest,"This course guides you through the process of setting up and testing web applications using Vitest integrated with the React Testing Library and other essential libraries. Learn how to set up a React app with Vite, install dependencies, and initialize your project, as you explore the basics of Vitest and how it can fit into your testing strategy with instructor Cyrus Ndirangu. Configure ESLint and Prettier to maintain code quality and style consistency, before you get started with your first unit test. Progressively, discover best practices for testing application state and hooks quickly and efficiently. By the end of the course, you’ll be ready to write tests that validate your application's functionality, including testing mock API requests and ensuring correct routing using the React Router. With practical examples and expert guidance throughout, this course shows you why testing is so crucial and how to use it to improve your development workflow.",Course,2026-06-01 15:07 UTC,N/A,false,N/A,
Analyzing VoIP Traffic with Wireshark,"Voice over IP (VoIP) is a technology that sends voice data in packets using the IP network—allowing you to make calls using an internet connection instead of a traditional phone line. In this course, join Lisa Bock as she takes an in-depth look at VoIP protocols and components, as well as how to troubleshoot VoIP calls. Lisa begins with an overview of VoIP, discussing its uses, codecs, and components. She then reviews the protocols that make VoIP possible, including TCP/IP, RTP, SIP, Skinny, and the H.323 family. She provides a review of media gateways and network operations, including quality of service and DNS, that are critical to the success of VoIP. To wrap up, Lisa dives into Wireshark statistics, showing how to leverage these statistics to troubleshoot VoIP, such as Service Response Time, VOIP calls, and RTP Stream Analysis.",Course,2026-05-04 16:17 UTC,N/A,false,N/A,
Agile Project Management with Jira Cloud: 3 Advanced Topics,"<p>This third and final course in the <i>Agile Project Management with Jira Cloud</i> series covers advanced topics like how to use filters, identify and classify epics, and how to use dashboards. After you explore these new topics, see how to put it all together: review the Jira tools and workflows, and use them to create classic and next-gen kanban projects in Jira.</p><p>This course is part of a <a href=""https://www.linkedin.com/learning/paths/atlassian-agile-project-management-professional-certificate"" >Professional Certificate</a> from Atlassian.</p>",Course,2023-03-22 16:38 UTC,N/A,false,N/A,
Playwright: Design Patterns,"In this course, learn how to leverage design patterns to enhance your test automation framework using Playwright. By understanding and implementing patterns such as the Page Object Model, fixtures, and data-driven testing, you'll be able to write cleaner, more maintainable, and scalable test scripts. This course is designed for test automation engineers and developers who want to improve their testing skills and ensure their tests are robust and easy to maintain. Through practical examples and hands-on exercises, gain the knowledge and skills needed to apply these design patterns effectively in your projects.",Course,2026-05-11 20:33 UTC,N/A,false,N/A,
Project Management with Microsoft Copilot,"Unlock the potential of Microsoft Copilot to streamline your project management tasks and boost efficiency. Taught by certified Project Management Professional and Microsoft MVP Cindy M. Lewis, this course is designed to equip project managers with skills to leverage Copilot seamlessly in daily workflows. Cindy provides practical, actionable tips for everything from generating clear project scope documents and effective communication plans to streamlining stakeholder reporting. Learn how to develop detailed project timelines, manage risks, and create compelling status reports. Harness the power of Copilot to stay on top of project discussions, identify data trends, and even get ideas to keep your team motivated and engaged.",Course,2025-07-07 12:51 UTC,N/A,false,N/A,
Advanced ASP.NET Core: Unit Testing,"No developer wants to turn in buggy code. Unit testing is a highly efficient way to ensure that everything in your app is working by design before it's launched into production. In this course, learn how to write automated tests for your personal or commercial ASP.NET Core apps. Instructor Ervis Trupja details how to unit test ASP.NET Core console, Web API, and MVC apps. Ervis begins by providing a general overview of application testing strategies, as well as how to determine which unit testing framework is right for you. Then, he steps through how to set up and test ASP.NET Core console, Web API, and MVC apps, providing challenges along the way that allow you to put your new skills to the test.",Course,2026-05-25 11:42 UTC,N/A,false,N/A,
Performance Testing Foundations,"Slow loading times can drive users away from even the most elegant website or application. But how can you pinpoint where your product's performance issues lie? In this course, join Dave Westerveld as he details the fundamentals of performance testing, including when and how to use the different types of tests and tools at your disposal. Discover how to determine what to measure and how to monitor the results of your tests. Explore the different types of performance testing—including load, stress, and scalability tests—and the contexts in which it's appropriate to use each of them. Plus, learn about a broad set of tools and how to pick the right one for the work you need to do.",Course,2026-04-26 12:55 UTC,N/A,false,N/A,
Learning Playwright,"It’s no surprise that Playwright has joined the ranks of other top-rated open-source automation tools. Playwright’s comprehensive feature set allows testers and developers to quickly create new test automation projects without having to combine multiple libraries and other tools. Whether you’re a manual tester, a quality assurance specialist, a software developer, or a seasoned automation engineer, this course offers hands-on, practical experience with using some of the most important features of Playwright. Join instructor Butch Mayhew as he takes you through the essentials and prepares you to start writing, running, analyzing, and debugging your first test.",Course,2025-07-23 12:25 UTC,N/A,false,N/A,
Integrating Azure DevOps with GitHub,"DevOps combines people, processes, and technologies to continuously deliver valuable products and services that meet end user needs and business objectives within the shortest possible time. Integrating Azure DevOps and GitHub provides more features for an organization to track the progress of a project, comply with industry standards, and manage code distribution and deployment. In this course, Prince Mokut explores how agile teams can integrate their GitHub repositories with Azure DevOps to leverage services like Azure Boards for project management and Azure Pipelines for continuous integration and delivery of your software. Prince starts by reviewing high-level functions of Azure DevOps and services, then covers how to customize dashboards, secure pipelines, and integrate tools from the Azure DevOps marketplace. After this course, you’ll have knowledge to help your team take advantage of this integration and seamlessly manage large software projects in your organization.",Course,2026-05-03 15:47 UTC,N/A,false,N/A,
