Software Testing Foundations: Test Planning,"The moment a product is placed on the roadmap, test managers must begin to strategize, calculate, and prepare for testing. The scope and execution of these tests is often defined by the size and impact of a product release. Whether it's leveraging past product testing or moving into an entirely new product line, you have to plan ahead to ensure that you mitigate issues while delivering a thorough and thoughtful test. This course provides testers and QA leads with the foundational knowledge they need to launch a successful test of a new software application, regardless of scale. Instructor Mike Fine steps through the entire planning process, from evaluating a product, to authoring a plan, to preparing to deliver results.",Course,2026-04-17 16:58 UTC,N/A,false,N/A,
Handling Customer Complaints with Empathy,"<p>Handling customer complaints is a critical skill for maintaining satisfaction and trust. In this course, customer service expert Sara Odirisio demonstrates the importance of addressing complaints with empathy and discovering unresolved issues. From understanding different types of complaints to mastering the appropriate language, posture, and gestures, this course helps you develop the skills required to de-escalate tense situations, offering strategies for active listening, asking the right questions, handling aggressive customers, and more. Sara guides you through a practical five-step process to resolve complaints and shares tips for addressing written complaints and ensuring follow-up. By the end of this course, you’ll be better prepared to navigate customer complaints with empathy, keeping interactions calm, professional, and solution-focused.</p><p>Note: This course was created by Sara Odorisio and CRFT Productions. We are pleased to host this training in our library.</p>",Course,2025-01-31 03:54 UTC,N/A,false,N/A,
Expert Domain-Driven Design (DDD) Implementation in .NET,"This course is aimed at .NET developers and architects interested in applying domain-driven design (DDD) in their projects. Instructor Rodrigo Díaz Concha takes you through the steps for creating a solution for a fictional pet medicine company to show you practical techniques to implement DDD using .NET and C#. Learn about using entities, value objects, aggregates, domain events, and more. This course is ideal for those looking to integrate DDD strategies and tools into their development solutions, as well as for software architects and .NET project stakeholders who want to understand how to implement DDD in their current or future initiatives.",Course,2026-06-05 11:56 UTC,N/A,false,N/A,
Learning Jenkins,"Do you need to automate tasks as part of your software development, system administration, or engineering work? This course introduces you to Jenkins, a highly configurable application used to automate software development and system administration tasks, and helps you build confidence in using it. Jenkins is a key DevOps tool, along with Docker and Git. Instructor Michael Jenkins covers how to set up a personal installation of Jenkins and familiarize yourself with the program’s interface. Next, Michael steps through how to configure your first job in Jenkins.  After you get some experience with jobs, he explains the Jenkins plugin environment and how plugins are used to extend the functionality that Jenkins offers.  Finally, Michael wraps up with detailed instructions on organizing jobs in folders and views, as well as a brief look into creating pipelines as code.",Course,N/A,N/A,true,N/A,
Spring Data,"<p>Are you ready to get up and running with Spring Data 3? In this hands-on coding course, instructor Mary Ellen Bowman guides you through the essential steps of implementing Spring Data JPA features for persisting and querying relational databases. Along the way, get an overview of Spring Data REST, Spring Data MongoDB, and how to leverage reactive repositories that support non-blocking data source drivers—all from directly within your browser.</p><p>This course is integrated with GitHub Codespaces, an instant cloud developer environment that offers all the functionality of your favorite IDE without the need for any local machine setup. With GitHub Codespaces, you can get hands-on practice from any machine, at any time—all while using a tool that you’ll likely encounter in the workplace. Check out “Using GitHub Codespaces"" with this course to learn how to get started.</p>",Course,2025-06-17 01:46 UTC,N/A,false,N/A,
What Is a PMO?,Many businesspeople still don’t understand what a project management office (PMO) is or what it does. Learn about the purpose of a PMO and why it is so important to the success of a modern business in this course with PMP Andy Jordan. Andy compares the different PMO models and identifies the roles a PMO plays in business planning and strategy execution. This brief course can help you apply the concept of a PMO to your own business and identify opportunities to optimize project delivery and achieve better results.,Course,2022-08-01 09:25 UTC,N/A,false,N/A,
Power BI Essential Training (2020),"Discover how to quickly glean insights from your data using Power BI. This formidable set of business analytics tools—which includes the Power BI service, Power BI Desktop, and Power BI Mobile—can help you more effectively create and share impactful visualizations with others in your organization. In this course, Gini von Courter helps you get started with this powerful toolset. Gini begins by covering the web-based Power BI service, explaining how to import data, create visualizations, and arrange those visualizations into reports. She discusses how to pin visualizations to dashboards for sharing, as well as how to ask questions about your data with Power BI Q&A. She also provides coverage of Power BI Mobile and shows how to use the data modeling capabilities in Power BI Desktop.",Course,2020-11-05 15:41 UTC,N/A,false,N/A,
Learning Jira (Cloud Edition),"<p>Jira was designed to help software development teams manage projects and track bugs and issues. But increasingly, teams in other fields—such as marketing, legal, and finance—are adopting it as well. Want to leverage Jira to track your own work and improve your outcomes and overall performance?</p><p>Tune into this course with Atlassian Certified Jira Administrator Rachel Wright to learn how to get up and running with the latest version of the cloud edition of this powerful project management tool. Rachel shows you how to use Jira to manage your own personal daily tasks and help your organization and team plan their strategic initiatives. Learn how to navigate Jira, work with projects and issues, change user preferences, estimate effort and track time, and create custom views such as filters, dashboards, boards, and more. By the end of this course, you'll be equipped with the core skills and know-how required to get started with Jira right away.</p>",Course,2026-03-03 18:39 UTC,N/A,true,N/A,
